{
  "$schema": "./schemas/command-registry.schema.json",
  "registry_version": "1.0.0",
  "wire_protocol": { "major": 1, "minor": 0 },
  "binary": "manuvra",
  "minimum_macos": "26.0",
  "operational_stdout_max_bytes": 4096,
  "error_catalog": "./error-catalog.json",
  "help_baseline": "./agent-help.md",
  "commands": [
    {
      "id": "system.commands.list",
      "cli": ["commands", "list"],
      "summary": "List compact command descriptors from the installed registry.",
      "effect": "read",
      "authority": "none",
      "modes": [],
      "default_timeout_ms": 2000,
      "maximum_timeout_ms": 120000,
      "capabilities": [],
      "input_schema": "./schemas/command-inputs.schema.json#/$defs/commands_list",
      "result_schema": "./schemas/command-results.schema.json#/$defs/registry_page",
      "examples": [{ "cli": "manuvra commands list", "input": { "limit": 10 } }],
      "since": "1.0.0"
    },
    {
      "id": "system.commands.get",
      "cli": ["commands", "get"],
      "summary": "Describe one command without assuming project context.",
      "effect": "read",
      "authority": "none",
      "modes": [],
      "default_timeout_ms": 2000,
      "maximum_timeout_ms": 120000,
      "capabilities": [],
      "input_schema": "./schemas/command-inputs.schema.json#/$defs/commands_get",
      "result_schema": "./schemas/command-results.schema.json#/$defs/command_help",
      "examples": [{ "cli": "manuvra commands get action.click", "input": { "command": "action.click" } }],
      "since": "1.0.0"
    },
    {
      "id": "system.commands.schema",
      "cli": ["commands", "schema"],
      "summary": "Return the absolute path and digest of a packaged command schema.",
      "effect": "read",
      "authority": "none",
      "modes": [],
      "default_timeout_ms": 2000,
      "maximum_timeout_ms": 120000,
      "capabilities": [],
      "input_schema": "./schemas/command-inputs.schema.json#/$defs/commands_schema",
      "result_schema": "./schemas/command-results.schema.json#/$defs/schema_pointer",
      "examples": [{ "cli": "manuvra commands schema action.click --side input", "input": { "command": "action.click", "side": "input" } }],
      "since": "1.0.0"
    },
    {
      "id": "system.commands.errors",
      "cli": ["commands", "errors"],
      "summary": "Explain one stable error code and its safe recovery.",
      "effect": "read",
      "authority": "none",
      "modes": [],
      "default_timeout_ms": 2000,
      "maximum_timeout_ms": 120000,
      "capabilities": [],
      "input_schema": "./schemas/command-inputs.schema.json#/$defs/commands_errors",
      "result_schema": "./schemas/command-results.schema.json#/$defs/error_help",
      "examples": [{ "cli": "manuvra commands errors invalid_request", "input": { "code": "invalid_request" } }],
      "since": "1.0.0"
    },
    {
      "id": "system.commands.usage",
      "cli": ["commands", "usage"],
      "summary": "Enable, inspect, export, reset, or disable local aggregate raw-command usage.",
      "effect": "durable_write",
      "authority": "none",
      "modes": [],
      "default_timeout_ms": 5000,
      "maximum_timeout_ms": 120000,
      "capabilities": [],
      "input_schema": "./schemas/command-inputs.schema.json#/$defs/commands_usage",
      "result_schema": "./schemas/command-results.schema.json#/$defs/usage_result",
      "examples": [{ "cli": "manuvra commands usage show", "input": { "action": "show" } }],
      "since": "1.0.0"
    },
    {
      "id": "target.list",
      "cli": ["targets"],
      "summary": "Discover current Chrome and macOS targets, their presentation owner and title, and dynamic capabilities.",
      "effect": "read",
      "authority": "none",
      "modes": [],
      "default_timeout_ms": 2000,
      "maximum_timeout_ms": 120000,
      "capabilities": [],
      "input_schema": "./schemas/command-inputs.schema.json#/$defs/targets",
      "result_schema": "./schemas/command-results.schema.json#/$defs/target_page",
      "examples": [{ "cli": "manuvra targets", "input": { "limit": 10 } }],
      "since": "1.0.0"
    },
    {
      "id": "session.open",
      "cli": ["open"],
      "summary": "Open a background-by-default actor or observer session on one exact target generation.",
      "effect": "lifecycle",
      "authority": "none",
      "modes": ["background", "foreground"],
      "default_timeout_ms": 5000,
      "maximum_timeout_ms": 120000,
      "capabilities": [],
      "input_schema": "./schemas/command-inputs.schema.json#/$defs/open",
      "result_schema": "./schemas/command-results.schema.json#/$defs/session",
      "examples": [{ "cli": "manuvra open --target chrome_example", "input": { "target_id": "chrome_example", "role": "actor", "mode": "background", "lease_ttl_ms": 120000 } }],
      "since": "1.0.0"
    },
    {
      "id": "session.close",
      "cli": ["close"],
      "summary": "Close one session and remove all of its temporary artifacts.",
      "effect": "lifecycle",
      "authority": "session",
      "modes": [],
      "default_timeout_ms": 5000,
      "maximum_timeout_ms": 120000,
      "capabilities": [],
      "input_schema": "./schemas/command-inputs.schema.json#/$defs/close",
      "result_schema": "./schemas/command-results.schema.json#/$defs/closed",
      "examples": [{ "cli": "manuvra close --session s_example", "input": { "session_id": "s_example", "cancel_running": false } }],
      "since": "1.0.0"
    },
    {
      "id": "lease.manage",
      "cli": ["lease"],
      "summary": "Explicitly acquire, renew, or release the actor lease for a session.",
      "effect": "coordination",
      "authority": "session",
      "modes": [],
      "default_timeout_ms": 2000,
      "maximum_timeout_ms": 120000,
      "capabilities": [],
      "input_schema": "./schemas/command-inputs.schema.json#/$defs/lease",
      "result_schema": "./schemas/command-results.schema.json#/$defs/lease",
      "examples": [{ "cli": "manuvra lease renew --session s_example", "input": { "session_id": "s_example", "action": "renew" } }],
      "since": "1.0.0"
    },
    {
      "id": "action.click",
      "cli": ["click"],
      "summary": "Click one unambiguous semantic, reference, or frame-coordinate target.",
      "effect": "mutate",
      "authority": "actor",
      "modes": ["background", "foreground"],
      "default_timeout_ms": 5000,
      "maximum_timeout_ms": 120000,
      "capabilities": ["common.click", "observation.screenshot"],
      "input_schema": "./schemas/command-inputs.schema.json#/$defs/click",
      "result_schema": "./schemas/action-result.schema.json",
      "examples": [{ "cli": "manuvra click --session s_example --role button --name Save", "input": { "session_id": "s_example", "locator": { "kind": "semantic", "role": "button", "name": "Save" }, "button": "left", "count": 1 } }],
      "since": "1.0.0"
    },
    {
      "id": "action.type",
      "cli": ["type"],
      "summary": "Type text into one explicit target; global focus is never implicit.",
      "effect": "mutate",
      "authority": "actor",
      "modes": ["background", "foreground"],
      "default_timeout_ms": 5000,
      "maximum_timeout_ms": 120000,
      "capabilities": ["common.type", "observation.screenshot"],
      "input_schema": "./schemas/command-inputs.schema.json#/$defs/type",
      "result_schema": "./schemas/action-result.schema.json",
      "examples": [{ "cli": "manuvra type --session s_example --role textbox --text hello", "input": { "session_id": "s_example", "locator": { "kind": "semantic", "role": "textbox" }, "text": "hello", "replace": false } }],
      "since": "1.0.0"
    },
    {
      "id": "action.press",
      "cli": ["press"],
      "summary": "Press a normalized key against the session target or an explicit element.",
      "effect": "mutate",
      "authority": "actor",
      "modes": ["background", "foreground"],
      "default_timeout_ms": 5000,
      "maximum_timeout_ms": 120000,
      "capabilities": ["common.press", "observation.screenshot"],
      "input_schema": "./schemas/command-inputs.schema.json#/$defs/press",
      "result_schema": "./schemas/action-result.schema.json",
      "examples": [{ "cli": "manuvra press --session s_example --key Enter", "input": { "session_id": "s_example", "key": "Enter" } }],
      "since": "1.0.0"
    },
    {
      "id": "action.scroll",
      "cli": ["scroll"],
      "summary": "Scroll the session target or one explicit element by logical deltas.",
      "effect": "mutate",
      "authority": "actor",
      "modes": ["background", "foreground"],
      "default_timeout_ms": 5000,
      "maximum_timeout_ms": 120000,
      "capabilities": ["common.scroll", "observation.screenshot"],
      "input_schema": "./schemas/command-inputs.schema.json#/$defs/scroll",
      "result_schema": "./schemas/action-result.schema.json",
      "examples": [{ "cli": "manuvra scroll --session s_example --delta-x 0 --delta-y 480", "input": { "session_id": "s_example", "delta_x": 0.0, "delta_y": 480.0 } }],
      "since": "1.0.0"
    },
    {
      "id": "action.navigate",
      "cli": ["navigate"],
      "summary": "Navigate a target that advertises the common navigate capability.",
      "effect": "mutate",
      "authority": "actor",
      "modes": ["background", "foreground"],
      "default_timeout_ms": 10000,
      "maximum_timeout_ms": 120000,
      "capabilities": ["common.navigate", "observation.screenshot"],
      "input_schema": "./schemas/command-inputs.schema.json#/$defs/navigate",
      "result_schema": "./schemas/action-result.schema.json",
      "examples": [{ "cli": "manuvra navigate --session s_example --url https://example.test", "input": { "session_id": "s_example", "url": "https://example.test" } }],
      "since": "1.0.0"
    },
    {
      "id": "observe.query",
      "cli": ["observe", "query"],
      "summary": "Find bounded exact semantic matches and issue session-scoped references.",
      "effect": "read",